<?xml version="1.0" encoding="UTF-8"?>
<xs:schema xmlns:xs="http://www.w3.org/2001/XMLSchema">

	<xs:element name="mappings">
		<xs:complexType>
			<xs:sequence>
				<xs:element name="map" maxOccurs="unbounded">
					<xs:complexType>
						<xs:sequence>
							<xs:element name="class" maxOccurs="1">
								<xs:complexType>
									<xs:simpleContent>
										<xs:extension base="xs:string">
											<xs:attribute name="package" type="xs:string" />
										</xs:extension>
									</xs:simpleContent>
								</xs:complexType>
							</xs:element>
							<xs:element name="table" maxOccurs="1">
								<xs:complexType>
									<xs:sequence>
										<xs:element name="class" maxOccurs="1">
											<xs:complexType>
												<xs:simpleContent>
													<xs:extension base="xs:string">
														<xs:attribute name="package" type="xs:string" />
													</xs:extension>
												</xs:simpleContent>
											</xs:complexType>
										</xs:element>
										<xs:element name="constant" maxOccurs="1" />
										<xs:element name="explicitName" minOccurs="0" maxOccurs="1" />
									</xs:sequence>
								</xs:complexType>
							</xs:element>
						</xs:sequence>
					</xs:complexType>
				</xs:element>
			</xs:sequence>
		</xs:complexType>
	</xs:element>
</xs:schema>